{
  "schemaVersion": "0.5.0",
  "screenId": "main",
  "itemId": "svg1",
  "elements": [
    {
      "elementUid": "el_aaa",
      "bindings": [
        {
          "id": "b1",
          "target": "geometry.levelPercent",
          "source": {
            "type": "tag",
            "tagId": "TANK01.LEVEL"
          },
          "transform": {
            "kind": "direct"
          }
        }
      ]
    },
    {
      "elementUid": "el_bbb",
      "bindings": [
        {
          "id": "b2",
          "target": "style.fill",
          "source": {
            "type": "tag",
            "tagId": "PUMP01.FAULT"
          },
          "transform": {
            "kind": "discreteMap",
            "cases": [
              {
                "equals": true,
                "value": "#ef4444"
              },
              {
                "equals": false,
                "value": "#64748b"
              }
            ]
          }
        }
      ]
    },
    {
      "elementUid": "el_ccc",
      "bindings": [
        {
          "id": "b3",
          "target": "text.content",
          "source": {
            "type": "tag",
            "tagId": "PUMP01.STATE"
          },
          "transform": {
            "kind": "valueTable",
            "output": "text"
          }
        },
        {
          "id": "b4",
          "target": "style.fill",
          "source": {
            "type": "tag",
            "tagId": "PUMP01.STATE"
          },
          "transform": {
            "kind": "valueTable",
            "table": "TrangThaiBom",
            "output": "color"
          }
        }
      ]
    }
  ]
}
