{
  "schemaVersion": "0.4.0",
  "screenId": "main",
  "elements": [
    {
      "elementUid": "el_aaa",
      "bindings": [
        {
          "id": "b1",
          "target": "geometry.levelPercent",
          "source": {
            "type": "tag",
            "tagId": "TANK01.LEVEL"
          },
          "transform": {
            "kind": "direct"
          }
        }
      ]
    },
    {
      "elementUid": "el_bbb",
      "events": {
        "click": {
          "action": "toggle",
          "tag": "PUMP01.RUN_CMD"
        }
      }
    }
  ],
  "itemId": "svg1"
}
