{
  "schemaVersion": "0.4.0",
  "screenId": "main",
  "elements": [
    {
      "elementUid": "el_aaa",
      "bindings": [
        {
          "id": "b1",
          "target": "effect.flow",
          "source": {
            "type": "tag",
            "tagId": "TANK01.LEVEL"
          },
          "transform": {
            "kind": "linearScale",
            "inMin": 0,
            "inMax": 100,
            "outMin": 0,
            "outMax": 300,
            "clamp": true
          }
        }
      ]
    }
  ],
  "itemId": "svg1"
}
