{
  "schemaVersion": "0.4.0",
  "screenId": "main",
  "elements": [
    {
      "elementUid": "el_aaa",
      "bindings": [
        {
          "id": "b1",
          "target": "text.content",
          "source": {
            "type": "tag",
            "tagId": "PUMP01.FAULT"
          },
          "transform": {
            "kind": "discreteMap",
            "cases": [
              {
                "equals": true,
                "value": "Loi"
              },
              {
                "equals": false,
                "value": "OK"
              }
            ],
            "default": "--"
          }
        }
      ]
    }
  ],
  "itemId": "svg1"
}
