{
  "schemaVersion": "0.4.0",
  "screenId": "main",
  "elements": [
    {
      "elementUid": "el_aaa",
      "bindings": [
        {
          "id": "b1",
          "target": "effect.flow",
          "source": {
            "type": "tag",
            "tagId": "PUMP01.RUN_CMD"
          },
          "transform": {
            "kind": "direct"
          },
          "speed": 0
        }
      ]
    }
  ],
  "itemId": "svg1"
}
