{
  "schemaVersion": "0.4.0",
  "screenId": "main",
  "elements": [
    {
      "elementUid": "el_aaa",
      "bindings": [
        {
          "id": "b1",
          "target": "style.fill",
          "source": {
            "type": "tag",
            "tagId": "PUMP01.NAME"
          },
          "transform": {
            "kind": "discreteMap",
            "cases": [
              {
                "equals": "run",
                "value": "#2e7d32"
              }
            ],
            "default": "#808080"
          }
        }
      ]
    }
  ],
  "itemId": "svg1"
}
